{"Schema":"rackcad-i64-cell-probe/v1","RunId":"R20261011T030925Z-a198","HeadSha":"db0f9d2bc890d74f40a337bda61f18cbc56979ed","OriginMainSha":"bb0d5522e8411f66a51fdfb3f1f0d0514b737453","AmendmentBlob":"725e96664ca7a8f3dec506690573a6c4326e19a3","CommandsRun":["git rev-parse HEAD","git rev-parse origin/main","git rev-parse HEAD:docs/initiatives/I-64-A-6.md"]}